{
  "entities": [
    {
      "class": "line",
      "closure": {
        "closed_by_endpoint": false,
        "closed_by_knots": false,
        "periodic": false
      },
      "geometry": {
        "end": [
          {
            "decimal": "3e-9",
            "f64_hex": "0x3e29c511dc3a41df",
            "precision": 1
          },
          {
            "decimal": "4e-9",
            "f64_hex": "0x3e312e0be826d695",
            "precision": 1
          },
          {
            "decimal": "0e+0",
            "f64_hex": "0x0000000000000000",
            "precision": 1
          }
        ],
        "start": [
          {
            "decimal": "0e+0",
            "f64_hex": "0x0000000000000000",
            "precision": 1
          },
          {
            "decimal": "0e+0",
            "f64_hex": "0x0000000000000000",
            "precision": 1
          },
          {
            "decimal": "0e+0",
            "f64_hex": "0x0000000000000000",
            "precision": 1
          }
        ]
      },
      "parameter_domain": {
        "end": {
          "decimal": "5e-9",
          "f64_hex": "0x3e35798ee2308c3a",
          "precision": 1
        },
        "start": {
          "decimal": "0e+0",
          "f64_hex": "0x0000000000000000",
          "precision": 1
        }
      },
      "samples": [
        {
          "curvature": {
            "decimal": "0.00000000000e+0",
            "f64_hex": "0x0000000000000000",
            "precision": 12
          },
          "derivative_exclusion": null,
          "parameter": {
            "decimal": "0.00000000000e+0",
            "f64_hex": "0x0000000000000000",
            "precision": 12
          },
          "point": [
            {
              "decimal": "0.00000000000e+0",
              "f64_hex": "0x0000000000000000",
              "precision": 12
            },
            {
              "decimal": "0.00000000000e+0",
              "f64_hex": "0x0000000000000000",
              "precision": 12
            },
            {
              "decimal": "0.00000000000e+0",
              "f64_hex": "0x0000000000000000",
              "precision": 12
            }
          ],
          "tangent": [
            {
              "decimal": "6.00000000000e-1",
              "f64_hex": "0x3fe3333333333333",
              "precision": 12
            },
            {
              "decimal": "8.00000000000e-1",
              "f64_hex": "0x3fe999999999999a",
              "precision": 12
            },
            {
              "decimal": "0.00000000000e+0",
              "f64_hex": "0x0000000000000000",
              "precision": 12
            }
          ]
        },
        {
          "curvature": {
            "decimal": "0.00000000000e+0",
            "f64_hex": "0x0000000000000000",
            "precision": 12
          },
          "derivative_exclusion": null,
          "parameter": {
            "decimal": "3.12500000000e-10",
            "f64_hex": "0x3df5798ee2308c3a",
            "precision": 12
          },
          "point": [
            {
              "decimal": "1.87500000000e-10",
              "f64_hex": "0x3de9c511dc3a41df",
              "precision": 12
            },
            {
              "decimal": "2.50000000000e-10",
              "f64_hex": "0x3df12e0be826d695",
              "precision": 12
            },
            {
              "decimal": "0.00000000000e+0",
              "f64_hex": "0x0000000000000000",
              "precision": 12
            }
          ],
          "tangent": [
            {
              "decimal": "6.00000000000e-1",
              "f64_hex": "0x3fe3333333333333",
              "precision": 12
            },
            {
              "decimal": "8.00000000000e-1",
              "f64_hex": "0x3fe999999999999a",
              "precision": 12
            },
            {
              "decimal": "0.00000000000e+0",
              "f64_hex": "0x0000000000000000",
              "precision": 12
            }
          ]
        },
        {
          "curvature": {
            "decimal": "0.00000000000e+0",
            "f64_hex": "0x0000000000000000",
            "precision": 12
          },
          "derivative_exclusion": null,
          "parameter": {
            "decimal": "6.25000000000e-10",
            "f64_hex": "0x3e05798ee2308c3a",
            "precision": 12
          },
          "point": [
            {
              "decimal": "3.75000000000e-10",
              "f64_hex": "0x3df9c511dc3a41df",
              "precision": 12
            },
            {
              "decimal": "5.00000000000e-10",
              "f64_hex": "0x3e012e0be826d695",
              "precision": 12
            },
            {
              "decimal": "0.00000000000e+0",
              "f64_hex": "0x0000000000000000",
              "precision": 12
            }
          ],
          "tangent": [
            {
              "decimal": "6.00000000000e-1",
              "f64_hex": "0x3fe3333333333333",
              "precision": 12
            },
            {
              "decimal": "8.00000000000e-1",
              "f64_hex": "0x3fe999999999999a",
              "precision": 12
            },
            {
              "decimal": "0.00000000000e+0",
              "f64_hex": "0x0000000000000000",
              "precision": 12
            }
          ]
        },
        {
          "curvature": {
            "decimal": "0.00000000000e+0",
            "f64_hex": "0x0000000000000000",
            "precision": 12
          },
          "derivative_exclusion": null,
          "parameter": {
            "decimal": "9.37500000000e-10",
            "f64_hex": "0x3e101b2b29a4692b",
            "precision": 12
          },
          "point": [
            {
              "decimal": "5.62500000000e-10",
              "f64_hex": "0x3e0353cd652bb167",
              "precision": 12
            },
            {
              "decimal": "7.50000000000e-10",
              "f64_hex": "0x3e09c511dc3a41df",
              "precision": 12
            },
            {
              "decimal": "0.00000000000e+0",
              "f64_hex": "0x0000000000000000",
              "precision": 12
            }
          ],
          "tangent": [
            {
              "decimal": "6.00000000000e-1",
              "f64_hex": "0x3fe3333333333333",
              "precision": 12
            },
            {
              "decimal": "8.00000000000e-1",
              "f64_hex": "0x3fe999999999999a",
              "precision": 12
            },
            {
              "decimal": "0.00000000000e+0",
              "f64_hex": "0x0000000000000000",
              "precision": 12
            }
          ]
        },
        {
          "curvature": {
            "decimal": "0.00000000000e+0",
            "f64_hex": "0x0000000000000000",
            "precision": 12
          },
          "derivative_exclusion": null,
          "parameter": {
            "decimal": "1.25000000000e-9",
            "f64_hex": "0x3e15798ee2308c3a",
            "precision": 12
          },
          "point": [
            {
              "decimal": "7.50000000000e-10",
              "f64_hex": "0x3e09c511dc3a41df",
              "precision": 12
            },
            {
              "decimal": "1.00000000000e-9",
              "f64_hex": "0x3e112e0be826d695",
              "precision": 12
            },
            {
              "decimal": "0.00000000000e+0",
              "f64_hex": "0x0000000000000000",
              "precision": 12
            }
          ],
          "tangent": [
            {
              "decimal": "6.00000000000e-1",
              "f64_hex": "0x3fe3333333333333",
              "precision": 12
            },
            {
              "decimal": "8.00000000000e-1",
              "f64_hex": "0x3fe999999999999a",
              "precision": 12
            },
            {
              "decimal": "0.00000000000e+0",
              "f64_hex": "0x0000000000000000",
              "precision": 12
            }
          ]
        },
        {
          "curvature": {
            "decimal": "0.00000000000e+0",
            "f64_hex": "0x0000000000000000",
            "precision": 12
          },
          "derivative_exclusion": null,
          "parameter": {
            "decimal": "1.56250000000e-9",
            "f64_hex": "0x3e1ad7f29abcaf48",
            "precision": 12
          },
          "point": [
            {
              "decimal": "9.37500000000e-10",
              "f64_hex": "0x3e101b2b29a4692b",
              "precision": 12
            },
            {
              "decimal": "1.25000000000e-9",
              "f64_hex": "0x3e15798ee2308c3a",
              "precision": 12
            },
            {
              "decimal": "0.00000000000e+0",
              "f64_hex": "0x0000000000000000",
              "precision": 12
            }
          ],
          "tangent": [
            {
              "decimal": "6.00000000000e-1",
              "f64_hex": "0x3fe3333333333333",
              "precision": 12
            },
            {
              "decimal": "8.00000000000e-1",
              "f64_hex": "0x3fe999999999999a",
              "precision": 12
            },
            {
              "decimal": "0.00000000000e+0",
              "f64_hex": "0x0000000000000000",
              "precision": 12
            }
          ]
        },
        {
          "curvature": {
            "decimal": "0.00000000000e+0",
            "f64_hex": "0x0000000000000000",
            "precision": 12
          },
          "derivative_exclusion": null,
          "parameter": {
            "decimal": "1.87500000000e-9",
            "f64_hex": "0x3e201b2b29a4692b",
            "precision": 12
          },
          "point": [
            {
              "decimal": "1.12500000000e-9",
              "f64_hex": "0x3e1353cd652bb167",
              "precision": 12
            },
            {
              "decimal": "1.50000000000e-9",